[
    {
        "id": "enemy_skeleton",
        "name": "Skeleton Warrior",
        "level": 5,
        "hp": 50,
        "stats": {
            "strength": 15,
            "defense": 10,
            "magic": 0,
            "resistance": 5,
            "speed": 10
        },
        "rewards": {
            "exp": 25,
            "gold": 10,
            "drops": [
                {
                    "item_id": "item_bone",
                    "chance": 0.3
                }
            ]
        },
        "ai": "aggressive",
        "sprite": "undead_skeleton"
    },
    {
        "id": "enemy_zombie",
        "name": "Rotting Zombie",
        "level": 4,
        "hp": 100,
        "stats": {
            "strength": 20,
            "defense": 5,
            "magic": 0,
            "resistance": 2,
            "speed": 2
        },
        "rewards": {
            "exp": 30,
            "gold": 5
        },
        "ai": "basic",
        "sprite": "undead_zombie"
    },
    {
        "id": "enemy_ghost",
        "name": "Wailing Ghost",
        "level": 6,
        "hp": 40,
        "stats": {
            "strength": 5,
            "defense": 20,
            "magic": 15,
            "resistance": 20,
            "speed": 12
        },
        "rewards": {
            "exp": 40,
            "gold": 0
        },
        "ai": "aggressive",
        "sprite": "undead_ghost",
        "skills": [
            "skill_wail"
        ]
    }
]